template,count
considering the image findings which,1
please segment where the local,1
considering the given information can,1
in this case what region,1
where can lip like changes,1
in which location does sequence,1
what might contribute to restricted,1
in this image which area,1
in which area can we,1
given the nature of the,1
what might cause a nodular,1
if there is an accumulation,1
please identify where the pleural,1
could you highlight the potential,1
are there any findings that,1
based on the description what,1
where are the nodules located,1
given the follow up nature,1
what is the size of,1
please segment where the cyst,1
is there an abnormality present,1
what abnormal finding in the,1
is there any identifiable area,1
in which region could normal,1
are there any areas showing,1
considering common lung conditions can,1
where is the herniated cervical,1
where is the cervical spine,1
please segment where the abnormal,1
what is the potential risk,1
please segment the thickening of,1
if there s an infectious,1
which part of the brain,1
where can the postoperative manifestation,1
where does the catheter pass,1
is there any abnormal structure,1
where is the pericardium thickened,1
what might cause pericardial thickening,1
are there any locations in,1
could you segment the indistinct,1
is there a specific location,1
given that the boundary between,1
is there any visible fluid,1
are there any symptoms associated,1
please segment where the minimal,1
given the presence of minimal,1
where can we observe degenerative,1
what areas might indicate possible,1
if there is a correlation,1
please segment where the widespread,1
considering common lung pathologies can,1
where are the <lat> renal,1
are there any other potential,1
can you segment the cyst,1
where can we find pulmonary,1
can you segment a part,1
where are the glassy density,1
what area may require further,1
is there any deviation from,1
where does the possible bone,1
which part of the skull,1
please segment the nodular abnormality,1
which part of the kidney,1
where does the nodular high,1
in this case which part,1
where does the dilation occur,1
can you segment where hydronephrosis,1
what area shows abnormal dilation,1
what could cause the dilation,1
please segment where the consolidation,1
based on your analysis can,1
where is the subpleural inflammation,1
what area should a radiologist,1
please segment the nodules or,1
could you highlight the regions,1
what could lead to discomfort,1
where is the dilation and,1
please segment the affected region,1
is there a visible difference,1
where are the round air,1
can you segment where emphysema,1
considering the report findings where,1
where does the unusual tube,1
in this ct image which,1
where is the dilation of,1
what abnormality can be seen,1
can you segment the fluid,1
which side of the body,1
what might cause the dilation,1
are there any other structures,1
what type of intervention might,1
where are the linear high,1
are there any potential areas,1
please segment the affected area,1
please segment the spot like,1
where are the benign lesions,1
if we were to focus,1
where is the liquid density,1
is there any other lesion,1
how does the location and,1
where is the leaf shaped,1
what region has blurred margins,1
is there an area that,1
can you segment the postoperative,1
what could cause a linear,1
please segment where the sigmoid,1
are there any sections of,1
can you segment the <lat>,1
are there any differences between,1
given the size and shape,1
where does the <lat> renal,1
what region displays a potential,1
considering common locations for benign,1
where is the abnormal lung,1
where is the subcutaneous lesion,1
what region should be segmented,1
which area of the image,1
what regions might indicate potential,1
what type of cyst might,1
given the patient s age,1
what region of the <lat>,1
where can the <lat> parapelvic,1
in which region do the,1
what potential renal related conditions,1
identify and segment the abnormal,1
given your knowledge of medical,1
what part of the chest,1
where is the metal valve,1
what part of the heart,1
can you identify any prosthetic,1
what kind of cardiac surgery,1
where are the calcification foci,1
what type of lesion might,1
can you segment where multiple,1
what might cause an increase,1
can you segment the multiple,1
where can emphysema be found,1
where can we find emphysema,1
can you identify a region,1
please identify and segment multiple,1
which region might have reduced,1
please segment where the catheter,1
in which vessel does the,1
what structure could potentially be,1
if there is any potential,1
please segment the part that,1
could you highlight the circular,1
can you locate the circular,1
where can parapneumonic emphysema be,1
considering common lung conditions where,1
what could cause widespread circular,1
where does the liver parenchyma,1
are there any foreign objects,1
where does the catheter run,1
what is considered as post,1
what is an unusual finding,1
why might there be a,1
where is the pelvic effusion,1
in this image what region,1
which area has unclear edges,1
please segment where the extensive,1
where is the l1 vertebral,1
which spinal region is most,1
could you highlight and segment,1
given that multiple round low,1
could you segment the suspected,1
which renal abnormality appears to,1
are there any significant differences,1
what might indicate an early,1
in this image where would,1
where does the small amount,1
what could cause the accumulation,1
is there any region showing,1
given the general knowledge about,1
please segment where the nodules,1
are there any additional nodules,1
is there a need for,1
what type of abnormality is,1
what abnormality is observed in,1
considering the characteristics of the,1
where are the cysts located,1
what is the appearance of,1
are there any additional observations,1
could you differentiate between benign,1
where is the common bile,1
what might cause the absence,1
could the dilation of the,1
please segment where the focal,1
what potential risk factors could,1
how might this focal point,1
where is the atrophied <lat>,1
what might have caused the,1
if there are any functional,1
where is the renal failure,1
can you segment an abnormality,1
what area would require further,1
where is the degenerative change,1
which anatomical structure is likely,1
please segment where the cervical,1
given the provided report could,1
where is the <lat> lower,1
what abnormal finding could be,1
are there any other areas,1
which regions in the image,1
could these high density shadows,1
what area of the <lat>,1
in this image what renal,1
what might have led to,1
where is the abnormal area,1
where are the visible high,1
what part of the skull,1
if there are any areas,1
can you show me the,1
are there any known medical,1
where is the abnormality located,1
could you identify the unclear,1
considering the possibility of malignancy,1
are there any anatomical structures,1
where does the uneven thickening,1
where do you suspect omental,1
what abnormality stands out in,1
which abdominal region might require,1
what could cause a spot,1
could there be any clinical,1
what is the location of,1
where are the suspected renal,1
considering common medical knowledge where,1
is there a specific area,1
where are the fine reticular,1
what areas might indicate an,1
which area could potentially represent,1
where is the thickening of,1
in this image where can,1
is there a significant change,1
where is suspected cervical spondylosis,1
which region might experience compromised,1
in the context of spinal,1
please segment where the iliac,1
where can the irregular thickening,1
in which vessels do you,1
where does the irregularity in,1
which region may require further,1
where is the metallic shadow,1
what is the cause of,1
where is the non enhancing,1
can you segment and identify,1
what area of the kidney,1
what might cause the streaky,1
can you segment the sigmoid,1
